time,title,text
2017-09-13,Major Securities Exchange Picks With Rising August Volumes,"Despite a cloud of uncertainty looming over the global market environment due to rapidly changing climatic conditions - storming the industrial space with consecutive catastrophic disasters Hurricanes Harvey and Irma - and the palpable disagreement among the Fed officials over how quickly to raise interest rates, the performance of some pivotal players in the Securities and Exchanges industry has shown a ray of hope.   Also, on Jul 5, 2017, Intercontinental Exchange, Inc. ICE  has purchased the remaining 20% stake in ICE Endex shares from N.V. Nederlandse Gasunie. The buyout adds capabilities to Intercontinental Exchange's European gas and power portfolio.     We wait to see if new product initiatives and global presence help these major players in the Securities and Exchanges industry to post high trading volumes in the future.     The Zacks Securities and Exchanges industry is currently ranked at #105 (which lies in the upper half of the Zacks Industry Rank for 252 plus industries). Notably, the industry  has outperformed the broader market year to date, evident from a gain of 17.3% compared with the S&P 500's increase of 11.2%.       Stocks in Focus      Following are some key stocks which have exhibited robust trading volumes in August, witnessed upward estimate revisions and their respective share prices have also the industry, quarter to date:     CBOE Holdings, Inc.  CBOE  recorded an average daily volume (ADV) of 7.4 million contracts, having soared nearly 33% year over year. Additionally, the company witnessed 2017 and 2018 estimates moving north by nearly 0.6% and 1.8%, respectively, over the last 60 days. This is reflected through the company's Zacks Rank #2 (Buy). You can see    the complete list of today's Zacks #1 Rank (Strong Buy)   stocks here   .     Notably, shares of CBOE Holdings have rallied 14.6% quarter to date compared with the industry's gain of 2.9%. The long-term growth is pegged at 17.4%.       CME Group Inc.  CME  reported an ADV of 16 million contracts per day, improved 16% year over year. This apart, the company witnessed 2017 and 2018 estimates moving north by nearly 0.2% and 1%, respectively, over the last 60 days. The company carries a Zacks Rank #3 (Hold). The long-term growth is pegged at 10.6%.     Also, shares of CME Group have gained 3.9% quarter to date compared with the industry's growth of 2.9%.       Nasdaq, Inc.  NDAQ  posted an ADV of 134 million contracts with respect to U.S. equity derivatives, thus reflecting an increase of 7.5% year over year. Also, the company saw 2017 and 2018 estimates moving upward by nearly 1.7% and 0.4%, respectively, over the last 60 days. The company carries a Zacks Rank #3. The long-term growth is pegged at 8.7%.     Also, shares of Nasdaq have gained about 5% quarter to date compared with the industry's rise of 2.9%.       More Stock News: This Is Bigger than the iPhone! It could become the mother of all technological revolutions. Apple sold a mere 1 billion iPhones in 10 years but a new breakthrough is expected to generate more than 27 billion devices in just 3 years, creating a $1.7 trillion market.Zacks has just released a Special Report that spotlights this fast-emerging phenomenon and 6 tickers for taking advantage of it. If you don't buy now, you may kick yourself in 2020.        Click here for the 6 trades >> The views and opinions expressed herein are the views and opinions of the author and do not necessarily reflect those of Nasdaq, Inc."
2017-10-23,Can Market Services Revenue Aid Nasdaq (NDAQ) Q3 Earnings?,"Nasdaq, Inc.  NDAQ  is slated to report third-quarter 2017 results on Oct 25, before the market opens. Last quarter, the company delivered a positive earnings surprise of 6.25%. Let's see how things are shaping up for this announcement.           Nasdaq, Inc. Price and EPS Surprise                             Nasdaq, Inc. Price and EPS Surprise    |      Nasdaq, Inc. Quote    Zacks Rank  : Nasdaq carries a Zacks Rank #3 (Hold), which increases the predictive power of ESP as stocks with a favorable Zacks Rank #1 (Strong Buy), 2 (Buy) or 3 along with a positive Earnings ESP, have significantly higher chances of an earnings beat.     Conversely, the Sell-rated stocks (#4 or 5) should never be considered going into an earnings announcement, especially when the company is seeing negative estimate revisions.     Other Stocks to Consider      Some other stocks worth considering from the finance sector with the right combination of elements to surpass estimates this quarter are as follows:     Prudential Financial PRU  is set to report third-quarter earnings on Nov 1 with an Earnings ESP of +0.07% and a Zacks Rank #2. You can see    the complete list of today's Zacks #1 Rank stocks   here   .Lincoln National Corporation LNC  has an Earnings ESP of +0.05% and also holds a Zacks Rank of 2. The company is slated to report third-quarter earnings on Nov 1.     American Equity Investment Life Holding Company AEL  has an Earnings ESP of +0.40% and sports a Zacks Rank of 1. The company is set to report third-quarter earnings on Nov 6.   Will You Make a Fortune on the Shift to Electric   Cars? Here's another stock idea to consider. Much like petroleum 150 years ago, lithium power may soon shake the world, creating millionaires and reshaping geo-politics. Soon electric vehicles (EVs) may be cheaper than gas guzzlers. Some are already reaching 265 miles on a single charge.With battery prices plummeting and charging stations set to multiply, one company stands out as the #1 stock to buy according to Zacks research.It's not the one you think.        See This Ticker Free >> The views and opinions expressed herein are the views and opinions of the author and do not necessarily reflect those of Nasdaq, Inc."
2017-06-13,"Nasdaq, Inc. (NDAQ) Ex-Dividend Date Scheduled for June 14, 2017","The previous trading day's last sale of NDAQ was $70.4, representing a -2.92% decrease from the 52 week high of $72.52 and a 15.05% increase over the 52 week low of $61.19.NDAQ is a part of the Finance sector, which includes companies such as Goldman Sachs Group, Inc. ( GS  ) and Morgan Stanley ( MS  ). NDAQ's current earnings per share, an indicator of a company's profitability, is $.83. Zacks Investment Research reports NDAQ's forecasted earnings growth in 2017 as 11.88%, compared to an industry average of 16.2%.For more information on the declaration, record and payment dates, visit the NDAQ Dividend History  page. Our  Dividend Calendar  has the full list of stocks that have an ex-dividend today. Interested in gaining exposure to NDAQ through an Exchange Traded Fund [ETF]?    The following ETF(s) have NDAQ as a top-10 holding: The top-performing ETF of this group is IAI with an increase of 5.02% over the last 100 days. It also has the highest percent weighting of NDAQ at 3.97%. The views and opinions expressed herein are the views and opinions of the author and do not necessarily reflect those of Nasdaq, Inc."
2018-04-27,Key Takeaways From CME's Q1,"We have a $146 price estimate for CME's stock  , which is below the current market price. We have created an    interactive dashboard   where you can change the company's forecast revenue, margins, and other key drivers to gauge how they would impact its expected results and valuation.    Despite the recent declines, the company remains bullish on its Market Data and Information Services segment, with new products in the pipeline with enhanced business intelligence and machine learning capabilities. The company has managed to gain traction by offering data services to its customers largely free of charge until recently, and we expect that many of its existing customers will be willing to pay for more advanced products.           Recent rate hikes and the Fed's indications of a series of hikes in the year ahead has boosted investor interest in interest rate derivatives, with trading volumes 29% ahead of the levels seen in Q1 2017. Energy derivatives maintained solid volumes with the recent surge in  oil prices  and OPEC's recent stance on capping production. Meanwhile, metal derivatives saw a 39% growth in trading volumes as they are considered a safe investment asset. Moreover, the continuous movements in gold and  silver prices  have continued to boost metals derivative volumes. We expect further volume growth with further improvement in the U.S. economy.    CME also recently launched bitcoin futures trading on its platform. With this initiative, the company is looking to get an early mover's advantage in the volatile but fast-growing space. Out of a total limit of 21 million bitcoins which can be mined, based on the existing protocol, the current bitcoins in circulation stands around 17 million. With the growth in supply slowing down, bitcoin trading provides a solid opportunity for exchanges. Over the long run, this could provide a healthy boost to CME's trading volumes.What's behind Trefis? See How It's Powering New Collaboration and What-IfsFor CFOs and Finance Teams   | Product, R&D, and Marketing Teams    More Trefis Research Like our charts? Explore example interactive dashboards   and create your own. The views and opinions expressed herein are the views and opinions of the author and do not necessarily reflect those of Nasdaq, Inc."
2018-01-05,ICE's Q4 Results Likely To Be Affected By Dip In Derivative Trading,"Due to the rate hike in June 2016, and the expectations of further rate increases by the end of 2016 (which did occur), IntercontinentalExchange's interest rate derivative volumes registered a sharp increase in Q4 2016. Consequently, Q4 2017 saw a decline in financial derivatives volumes due to the difficult year-on-year comparison.  However, we expect further growth in trading volumes with the Fed's expectation of further hikes in the year ahead. Meanwhile, we expect that metals - despite having shown a slight decline - will likely remain in demand as a safe investment asset, leading to fairly steady volumes.We have a $70 price estimate for ICE's stock  , which is about in line with the current market price.        See the full Trefis analysis for Intercontinental     Exchange    View Interactive Institutional Research (Powered by Trefis):    Global Large Cap  | U.S. Mid & Small Cap | European Large & Mid Cap        More Trefis   Research The views and opinions expressed herein are the views and opinions of the author and do not necessarily reflect those of Nasdaq, Inc."
2018-04-23,Is a Beat in Cards for Nasdaq (NDAQ) This Earnings Season?,"Nasdaq, Inc  . NDAQ  is slated to report first-quarter 2018 results on Apr 25 before the market opens. Last quarter, the company delivered a positive surprise of 3.96%.      Nasdaq, Inc. Price and EPS Surprise                           Nasdaq, Inc. Price and EPS Surprise    |      Nasdaq, Inc. Quote    You can uncover the best stocks to buy or sell before they are reported with our Earnings ESP Filter.      Zacks Rank  : Nasdaq carries a Zacks Rank #3, which increases the predictive power of ESP.     You can see    the complete list of today's Zacks #1 Rank stocks   here   .     We caution against Sell-rated stocks (#4 or 5) going into an earnings announcement, especially when the company is seeing negative estimate revisions.     Other Stocks to Consider      Some other companies worth considering from the finance sector with the right combination of elements to also come up with an earnings beat this time around are as follows:     Aflac Incorporated AFL  has an Earnings ESP of +1.73% and a Zacks Rank #2. The company is slated to report first-quarter earnings on Apr 25.     Altisource Portfolio Solutions S.A. ASPS  has an Earnings ESP of +17.65% and is a Zacks #3 Ranked player. The company is slated to announce first-quarter earnings on Apr 26.     BofI Holding, Inc. BOFI  has an Earnings ESP of +0.86% and is a #3 Ranked player. The company is slated to release first-quarter earnings on Apr 26.     Today's Stocks from Zacks' Hottest Strategies      It's hard to believe, even for us at Zacks. But while the market gained +21.9% in 2017, our top stock-picking screens have returned +115.0%, +109.3%, +104.9%, +98.6%, and +67.1%. And this outperformance has not just been a recent phenomenon. Over the years it has been remarkably consistent. From 2000 - 2017, the composite yearly average gain for these strategies has beaten the market more than 19X over. Maybe even more remarkable is the fact that we're willing to share their latest stocks with you without cost or obligation.        See Them Free>> The views and opinions expressed herein are the views and opinions of the author and do not necessarily reflect those of Nasdaq, Inc."
2018-07-02,"Financial Sector Update for 07/02/2018: FCPT,WPG,NDAQ,IX","JPM -0.39%BAC -0.64%WFC -0.04%C 0.43%USB 0.00%Financial were mostly lower in early trading.In economic news:A pair of manufacturing reports are on tap later this morning. The purchasing managers index for manufacturing activites during June is due out at 9:45 a.m. ET, with analysts polled by Econoday expecting a 1.8-point drop from May levels to a 54.6 final reading, unchanged from the mid-month flash score, with new orders slipping and export sales sliding to a two-year low amid the rising impact of the US trade war with China, Canada and the European Union.The ISM manufacturing index for June is out at 10 a.m. ET, with the Econoday consensus calling for a small slowing to a 58.3 June reading compared with May's 58.7 reading. Also at 10 a.m., construction spending is expected to rise 0.6% in May following a 1.8% increase in April, which reversed a 1.7% decline the prior month. Year-over-year, construction spending is seen rising 7.6% over May 2017.Among financial stocks likely to move on news:- Four Corners Property Trust ( FCPT  ) late Friday said it has closed on its $9.5 million purchase of five restaurant properties from Washington Prime Group ( WPG  ). The five properties are in highly trafficked retail corridors in Florida, Indiana, Illinois, Ohio, and Texas and represent five different restaurant brands, Four Corners said.In other sector news:- Nasdaq ( NDAQ  ) early Monday said it signed a deal to provide clearing, risk management and settlement technology to the National Stock Exchange of India. The American stock market operator also will provide technology to replace NSE's current clearing and settlement system and the companies also agreed to explore potential business opportunities across listings, corporate and market services and data.- Orix Corp ( IX  ) Sunday said its US unit has agreed to acquire privately-held NXT Capital for an undisclosed amount. Chicago-based NXT Capital provides a range of structured funding services. The deal should be completed by August, subject to customary closing conditions. The views and opinions expressed herein are the views and opinions of the author and do not necessarily reflect those of Nasdaq, Inc. Copyright (C) 2016 MTNewswires.com. All rights reserved. Unauthorized reproduction is strictly prohibited."
2017-01-30,Why Nasdaq Inc. (NDAQ) Might Surprise This Earnings Season,"Investors are always looking for stocks that are poised to beat at earnings season and Nasdaq, Inc.  NDAQ  may be one such company. The firm has earnings coming up pretty soon, and events are shaping up quite nicely for their report.That is because Nasdaq Inc. is seeing favorable earnings estimate revision activity as of late, which is generally a precursor to an earnings beat. After all, analysts raising estimates right before earnings-with the most up-to-date information possible-is a pretty good indicator of some favorable trends underneath the surface for NDAQ in this report.In fact, the Most Accurate Estimate for the current quarter is currently at 95 cents per share for NDAQ, compared to a broader Zacks Consensus Estimate of 94 cents per share. This suggests that analysts have very recently bumped up their estimates for NDAQ, giving the stock a Zacks Earnings ESP of 1.06% heading into earnings season.   Nasdaq, Inc. Price and EPS Surprise                           Nasdaq, Inc. Price and EPS Surprise    |      Nasdaq, Inc. Quote      Why is this Important? A positive reading for the Zacks Earnings ESP has proven to be very powerful in producing both positive surprises, and outperforming the market. Our recent 10 year backtest shows that stocks that have a positive Earnings ESP and a Zacks Rank #3 (Hold) or better show a positive surprise nearly 70% of the time, and have returned over 28% on average in annual returns (see more Top Earnings ESP stocks here  ).Given that NDAQ has a Zacks Rank #3 (Hold) and an ESP in positive territory, investors might want to consider this stock ahead of earnings. You can see    the complete list of today's Zacks #1 Rank   (Strong Buy) stocks here   .Clearly, recent earnings estimate revisions suggest that good things are ahead for Nasdaq Inc., and that a beat might be in the cards for the upcoming report.   Zacks' Top Investment Ideas for Long-Term Profit How would you like to see our best recommendations to help you find today's most promising long-term stocks? Starting now, you can look inside our portfolios featuring stocks under $10, income stocks, value investments and more. These picks, which have double and triple-digit profit potential, are rarely available to the public. But you can see them now. Click here >> The views and opinions expressed herein are the views and opinions of the author and do not necessarily reflect those of Nasdaq, Inc."
2018-04-25,Nasdaq revenue rises 14.6 pct on higher trading volumes,"By John McCrank and Nikhil SubbaApril 25 (Reuters) - Nasdaq Inc  is open to launching a cryptocurrency exchange in the future as the regulatory environment evolves, the head of the exchange operator said on Wednesday.The view that cryptocurrencies, such as bitcoin   will be a future way to support commerce is becoming more mainstream, Nasdaq's Chief Executive Officer, Adena Friedman, said in an interview following the announcement of better-than-expected quarterly earnings.""Over time, if it ultimately does morph into a regulated environment, it does give us an opportunity to participate as a marketplace, but I think that is a longer road and it doesn't have a certain path right now,"" she said.In the meantime, Nasdaq is exploring deals with several virtual currency exchanges to provide market infrastructure technology for trading and clearing, as well as surveillance, she said.Nasdaq on Wednesday announced a surveillance deal with Gemini Trust Company to monitor cryptocurrency trading on its exchange for potential market manipulation and fraud. EARNINGSNasdaq's net income in the first quarter rose to $177 million, or $1.05 per share, from $168 million, or 99 cents per share, a year earlier, helped by a volatility-driven spike in trading volumes. Stripping out special items, such as merger and acquisitions costs, the transatlantic exchange operator earned $1.24 per share, topping analysts' average estimates by four cents, according to Thomson Reuters I/B/E/S.Volatility spiked in February after a prolonged calm in 2017, roiling global equities, bonds, currencies and commodities markets, and remained elevated through the end of March.Revenue rose 14.6 percent to $666 million. Revenue from market services, the company's largest business, jumped more than 21 percent to $735 million.Sales from Nasdaq's non-trading related businesses also grew, with revenue from its market technology unit rising 7.7 percent to $70 million, and revenue from information services up 26 percent at $174 million.Corporate services, which includes market listings, rose 7.5 percent to $172 million, as Nasdaq saw 37 IPOs in the quarter, including those of cloud storage company Dropbox  and Chinese video streaming platform iQiyi."
2017-10-25,"Nasdaq (NDAQ) Q3 Earnings Beat Estimates, Revises Outlook","Have you been eager to see how Nasdaq, Inc.  NDAQ  , performed in Q3 in comparison with the market expectations? Let's quickly scan through the key facts from this NY-based major exchange operator's earnings release this morning:           Nasdaq, Inc. Price and EPS Surprise                             Nasdaq, Inc. Price and EPS Surprise    |      Nasdaq, Inc. Quote    How Was the Estimate Revision Trend?      You should note that the earnings estimate for Nasdaq depicted neutral stance prior to the earnings release. The Zacks Consensus Estimate remained unchanged at $1.02 per share over the last 7 days.     Nasdaq has a decent earnings surprise history. Overall, the company surpassed the Zacks Consensus Estimate by an average of 3.99% in the trailing four quarters.     Revenues Beat      Nasdaq's revenues of record $607 million in the quarter increased 3.8% year over year. The Zacks Consensus Estimate was $599 million.     Key Takeaways      Adjusted operating expenses were $317 million in the reported quarter, remaining unchanged from the year-ago quarter.     The Nasdaq Stock Market welcomed 78 new listings during the third quarter of 2017, 34 of which were IPOs.     As of Sep 30, 2017, debt dipped 0.4% over 2016 end level to $3.59 billion.     The company has returned $355 million to its shareholders during the first nine months of 2017.     The company expects its 2017 non-GAAP operating expense in the range of $1,275-$1,290 million.     What Zacks Rank Says      The estimate revisions that we discussed earlier have driven a Zacks Rank #3 (Hold) for Nasdaq. However, since the latest earnings performance is yet to be reflected in the estimate revisions, the rank is subject to change. Now it all depends on what sense the just-released report makes to the analysts.     You can see    the complete list of today's Zacks #1 Rank (Strong Buy)   stocks here   . Check back later for our full write up on this Nasdaq earnings report!   Zacks' Hidden Trades While we share many recommendations and ideas with the public, certain moves are hidden from everyone but selected members of our portfolio services. Would you like to peek behind the curtain today and view them?Starting now, for the next month, I invite you to follow all Zacks' private buys and sells in real time from value to momentum...from stocks under $10 to ETF to option movers...from insider trades to companies that are about to report positive earnings surprises (we've called them with 80%+ accuracy). You can even look inside portfolios so exclusive that they are normally closed to new investors.        Click here for Zacks' secret trade>> The views and opinions expressed herein are the views and opinions of the author and do not necessarily reflect those of Nasdaq, Inc."
