time,title,text
2017-04-08,3 Ways to Invest in Blockchain Technology Without Buying Bitcoins,"Investors in bitcoin have enjoyed an incredible year. Twelve   months ago, the price for one unit of the cryptocurrency stood at   just about $420. As I write, one bitcoin trades for $1,045 -- an   approximate 149% gain in just one year.However, the dramatic rise in   bitcoin    over the past year doesn't begin to tell the story of its   volatile trading history. In late 2013, the trading price for one   bitcoin was over $1,100. By January 2015, the price had plunged   again, this time to under $200. Following this incredible drop,   the digital monetary unit began its current meteoric rise. This   instability is inherent in investing in a currency that is not   backed or regulated by any national government, or based on   something of tangible value, like gold. Check out this chart   showing bitcoin fluctuations.                          ^NYB    data by   YCharts   It's not just the currency's stomach-churning volatility that   turns some people off from   investing in bitcoin    . The lack of regulation or palpable value behind the currency   causes many people to consider bitcoin somewhat akin to   Monopoly    money. On the other hand, the blockchain technology behind   bitcoin has a chance to be disruptive across so many different   industries and investors might be more willing to get behind   that.Blockchain technology is essentially a publicly distributed   ledger. When transactions using this technology are completed,   they are recorded on the newest ""block."" When a block's capacity   is filled, it is added to the end of the ""chain"" in linear order.   This way of transferring money, supplies, or other assets   eliminates the need for each transaction to go through various   middlemen, like brokerages, payment processors, and even banks.   The fewer third-parties involved in facilitating transactions,   the fewer players that take a small cut.Here are three companies that clearly see many opportunities   ahead for this potentially transformative technology, and that   are working to incorporate it in their respective fields.           Image source: Getty Images.Count   Broadridge Financial Solutions, Inc.    (NYSE: BR) CEO Rich Daly among those who see the opportunities   for blockchain technology in finance. Last summer,   Daly wrote in   Forbes       :Some people know blockchain as the underlying technology     behind the controversial digital currency Bitcoin. However,     blockchain is so much more; it's incredibly innovative and its     promise is far-reaching. This technology is a secure and     transparent way to digitally track the ownership of assets     before, during and after transactions, and it has the potential     to ultimately transform everything from how stock exchanges     operate to how proxies are voted.Broadridge Financial handles mundane tasks for brokerages and   financial institutions such as facilitating proxy votes and   processing equity trades. The company believes blockchain   technology can streamline these processes, making them faster,   cheaper, and more secure.In the same editorial quoted above, Daly lists syndicated   loans as an example where blockchain technology would accomplish   these goals. Syndicated loans, Daly states, currently take up to   20 days to settle in a labor-intensive process. With blockchain,   the process would be much faster and would cost less in legal   fees and to close.Last September,   Broadridge made its latest investment    in this space, buying the technology assets of Inveshare, Inc.   for a total of $135 million. The acquisition was for the sole   purpose of accelerating Broadridge's use of blockchain technology   in its proxy business.   Nasdaq, Inc.    (NASDAQ: NDAQ) is the world's second largest stock exchange and   has been experimenting with blockchain technology for years. In   the final days of 2015,      Nasdaq announced    it had completed the first issuing of a private company's shares   to an investor via blockchain technology on the company's Linq   platform.The use of blockchain technology eliminated the need to issue   paper stock certificates and ""significantly"" reduced the   transaction's settlement time, according to Nasdaq, which   believes the technology holds the same promise for stocks sold on   the public markets. In the press release announcing the historic   transaction, Nasdaq CEO Bob Greifeld said:Through this initial application of blockchain technology,     we begin a process that could revolutionize the core of capital     markets infrastructure systems. The implications for settlement     and outdated administrative functions are profound.This isn't the only way Nasdaq has experimented with using   blockchain technology. Earlier this year, the company   successfully used the technology to      process proxy voting    on its Estonian exchange. It is now contemplating whether to use   the same process for proxy voting across all of its   exchanges.Perhaps no company has more invested in blockchain technology   than   International Business Machines Corp.    (NYSE: IBM) . The company just launched IBM Blockchain, a   platform that will enable enterprise customers to build   applications in IBM's cloud using blockchain. The company   believes its cloud-based blockchain offerings -- a type of   blockchain-as-a-service -- will differentiate it from its many   cloud competitors.           Image source: International Business Machines Corp.CEO Ginni Rometty believes it cannot be overestimated how   important blockchain technology is to the company's future. In   the company's 2016   annual letter    , she stated:Blockchain brings together shared ledgers with smart     contracts to allow the secure transfer of any asset -- whether     a physical asset like a shipping container, a financial asset     like a bond or a digital asset like music -- across any     business network. Blockchain will do for trusted transactions     what the Internet did for information.Rometty says the company is currently working with over 400   clients on blockchain initiatives. These offerings are as diverse   as using the platform to work with   Wal-Mart Stores    to track food inventory, and with the London-based start-up   Everledger to track diamonds.Broadridge Financial, Nasdaq, and IBM are multibillion-dollar   companies with many moving parts. Their futures do not hinge on   blockchain technology, but each is aiming to use it in ways that   will cut costs, allow for faster service, or differentiate their   business services from competitors. All three companies are   avenues investors can explore to gain decent exposure to   blockchain technology without buying bitcoins.          10 stocks we like better than IBM            When investing geniuses David and Tom Gardner have a stock tip,     it can pay to listen. After all, the newsletter they have run     for over a decade,     Motley Fool Stock Advisor      , has tripled the market.*David and Tom just revealed what they believe are the            10 best stocks           for investors to buy right now... and IBM wasn't one of them!     That's right -- they think these 10 stocks are even better     buys.            Click here           to learn about these picks!       *Stock Advisor returns as of February 6, 2017                                       Matthew Cochrane      has no position in any stocks mentioned. The Motley Fool owns     shares of Broadridge Financial Solutions. The Motley Fool     recommends Nasdaq. The Motley Fool has a     disclosure policy      . The views and opinions expressed herein are the views and opinions of the author and do not necessarily reflect those of Nasdaq, Inc."
2018-02-01,"CME Group (CME) Q4 Earnings Beat Estimates, Revenues Dip Y/Y","CME Group Inc.  CME  reported fourth-quarter 2017 adjusted earnings per share of $1.12, beating the Zacks Consensus Estimate of $1.10. The bottom line, however, deteriorated 1.8% year over year.        CME Group Inc. Price, Consensus and EPS     Surprise                             CME Group Inc. Price, Consensus and EPS   Surprise    |      CME Group Inc. Quote    The year-over-year decline was mainly due to lower trading volumes as well as revenues. Nonetheless, options business remained sturdy in the quarter.    Performance of Other Companies in Securities Exchange Industry      The bottom line of Nasdaq, Inc. NDAQ  and MarketAxess Holdings Inc. MKTX  beat the respective Zacks Consensus Estimate in the quarter under review.     Intercontinental Exchange, Inc. ICE  will report fourth-quarter results on Feb 7 before the market opens. The Zacks Consensus Estimate for earnings in the period is pegged at 72 cents, up 1.4% year over year.   Wall Street's Next Amazon Zacks EVP Kevin Matras believes this familiar stock has only just begun its climb to become one of the greatest investments of all time. It's a once-in-a-generation opportunity to invest in pure genius.        Click for details >> The views and opinions expressed herein are the views and opinions of the author and do not necessarily reflect those of Nasdaq, Inc."
2016-10-26,"Nasdaq (NDAQ) Q3 Earnings Meet, Revenues Lag Estimates","Nasdaq, Inc  . NDAQ  posted third-quarter 2016 earnings of 91 cents per share, in line with the Zacks Consensus Estimate. The bottom line  improved 3.4% from 88 cents per share earned in the prior-year quarter. The impressive results were driven by impressive operational activities, strong listings and IPOs. Share buybacks also added to the upside.          FindTheCompany | Graphiq    Including one-time items, net income came in at 77 cents per share, down 3.7% year over year.         NASDAQ INC Price, Consensus and EPS Surprise                                         NASDAQ INC Price, Consensus and EPS Surprise    |      NASDAQ INC Quote    Performance of Other Stocks from Finance Sector      Among other players in the insurance industry that have reported their third-quarter earnings so far, earnings at Progressive Corp. PGR  and MGIC Investment Corp. MTG  beat their respective Zacks Consensus Estimate, while RLI Corp. RLI  missed the same.   Confidential from Zacks Beyond this Analyst Blog, would you like to see Zacks' best recommendations that are not available to the public? Our Executive VP, Steve Reitmeister, knows when key trades are about to be triggered and which of our experts has the hottest hand.    Click to see them now   >> The views and opinions expressed herein are the views and opinions of the author and do not necessarily reflect those of Nasdaq, Inc."
2017-04-28,3 Things You Didn't Know About Frontier Communications Corporation,"Frontier Communications    (NASDAQ: FTR) has gone from a small regional player in the   pay-television and broadband space by buying   Verizon    's (NYSE: VZ) wireline business in California, Texas, and Florida   (CTF) for $10.54 billion.That major deal brought the company approximately 3.3 million   voice connections, 2.1 million broadband connections, and 1.2   million FiOS video subscribers. It was a transaction that the   company undertook to increase its scale as well as help it gain   efficiencies.That part of the CTF purchase has been successful, with   Frontier on track to save nearly $1.5 billion annually across its   entire operation. Both the Verizon deal and the associated cost   savings have been well covered in media, and investors even   casually following the brand know what's going on there.The company does, however, have a number of things that many   investors, even shareholders, may not know. Not every one of   these items will surprise everyone, but each one tells a piece of   Frontier's story that perhaps hasn't been covered as much as it   should have been.                    Image source:   YCharts.   Since the Verizon deal closed a little over a year ago,   Frontier has been struggling, and its share price has been going   steadily in the wrong direction. To keep the company in   compliance with the   Nasdaq    , where its share are listed, the company's board has authorized   a reverse split, which shareholders will vote on in May,   according to the company's   Q4 earnings release    .""The charter amendment will provide for a reverse stock-split   ratio between 1-for-10 and 1-for-25, with the board designating   the final ratio within 90 days after the charter amendment is   approved by stockholders,"" the company wrote. ""Concurrent with   the reverse stock split, the conversion ratio of Frontier's   Series A 11.125% Mandatory Convertible Preferred Stock will   automatically be adjusted proportionately.""           Old-school landline phones are Frontier's second largest     source of revenue. Image source: Pixabay.While most analysts and journalists covering the company focus   on broadband and pay television subscriber counts, Frontier still   relies pretty heavily on revenue from what it call ""voice   services."" That category, which is what is now commonly referred   to as ""land lines,"" was the company's second largest category in   Q4.Voice services brought in $774 million for the period, behind   only data and internet services, which came in at just over $1   billion for the quarter. Like the company's cable and broadband   segments, its landline business has been shrinking as well,   dropping by $34 million in revenue from Q3 to Q4.While it's common in the wireless-phone space to offer   incentives to customers willing to switch providers, the tactic   is less common in cable and broadband. That may because in many   markets the incumbent carrier has never had any real competition,   and the alternatives, such as satellite, have chosen to use price   as their main marketing factor.Frontier, however, has often been willing to pony up for   customers willing to make the switch. Currently, it's running a   promotion in which new customers can receive an   Amazon.com    gift card for up to $400. To get that amount, the consumer will   need to bundle the company's top-tier cable and broadband   services, along with a phone line, but smaller amounts are   available at a variety of pricing tiers. In most cases, getting   the incentive requires agreeing to a two-year contract.Frontier Communications has seen its stock tumble over time,   and many investors simply dismiss the company then and there. But   the details of what's been happening with Frontier's business   give a lot of insight into the reasons behind the slide, and that   can be helpful for shareholders thinking about what to do   next.          10 stocks we like better than Frontier     Communications            When investing geniuses David and Tom Gardner have a stock tip,     it can pay to listen. After all, the newsletter they have run     for over a decade,     Motley Fool Stock Advisor      , has tripled the market.*David and Tom just revealed what they believe are the            10 best stocks           for investors to buy right now... and Frontier Communications     wasn't one of them! That's right -- they think these 10 stocks     are even better buys.            Click here           to learn about these picks!       *Stock Advisor returns as of April 3, 2017                                       Daniel Kline      has no position in any stocks mentioned. The Motley Fool owns     shares of and recommends Amazon and Verizon Communications. The     Motley Fool recommends Nasdaq. The Motley Fool has a     disclosure policy      . The views and opinions expressed herein are the views and opinions of the author and do not necessarily reflect those of Nasdaq, Inc."
2017-10-23,Intercontinental Exchange Buys BofA's Income Index Platform,"Intercontinental Exchange  ICE  recently acquired Bank of America Merrill Lynch Global Research division's fixed income index platform to ramp up its index services. The transaction is not expected to be accretive to 2017 financial results. The acquisition was announced in June of this year.The indices will be re-branded as ICE BofAML and come under the umbrella of ICE Data Services. The acquisition was announced in June this year.ICE BofAML Indices are the second-largest fixed income indices by assets under management (AUM) globally. The combination will result in an asset compilation of nearly $1 trillion in the AUM benchmarked combined fixed income index business of Intercontinental Exchange.With this acquisition, Intercontinental Exchange intends to expand its index offering to enable customers to select from a wide range of third-party benchmark solutions. Moreover, with the addition of the indices, the acquirer will now be able to offer a comprehensive portfolio that comprises more than 5,000 global fixed income, currency and commodity indices. ICE BofAML Indices will be offered along with ICE's existing index offering, which includes the ICE U.S. Treasury indices, introduced in 2015. Further, it is also inclusive of Intercontinental Exchange's index services, which serve as the basis for ETFs and structured products across fixed income, currencies, equities and commodities.Intercontinental Exchange's has solid history of acquisitions. Strategic acquisitions have not only expanded growth of ICE but have also resulted in expense synergies. On July 2017, Intercontinental Exchange completed the acquisition of CE Endex shares from N.V. Nederlandse Gasunie to add capabilities to the acquirer's European gas and power portfolio. Inorganic endeavors reflect the company's diversifying aims to emerge in rapidly growing markets, while enhancing its capital efficiency, cross-selling and product development opportunities in the long run.Mergers and acquisitions diversify and add capabilities to a company's portfolio, thereby accelerating its growth profile. Recently, Nasdaq, Inc. NDAQ  completed the buyout of London-based startup Sybenetix, to strengthen and expand its position in the surveillance space.    Zacks Rank & Share Price Movement Intercontinental Exchange carries a Zacks Rank #3 (Hold). You can see     the complete list of today's Zacks #1 Rank (Strong Buy)   stocks here   .Shares of Intercontinental Exchange have underperformed the industry   year to date. While Intercontinental shares have returned 17.2%, the industry has gained 19.7%. Nonetheless, we expect the company's diversified product offerings and strategic acquisitions to further drive its shares in the near term.        Stocks to Consider Some better-ranked stocks from the finance sector are CBOE Holdings CBOE  and Marsh & Mc Lennan Companies, Inc. MMC  . Each of these stocks carry a Zacks Rank #2 (Buy). CBOE holdings operates as an options exchange in the United States. The company delivered positive surprises in the trailing four quarters with an average beat of 5.66%.Marsh & McLennan Companies, Inc. provides advice and solutions in the areas of risk, strategy and people worldwide. The company delivered positive surprises in three of the last four quarters with an average beat of 3.76%.   Will You Make a Fortune on the Shift to Electric   Cars? Here's another stock idea to consider. Much like petroleum 150 years ago, lithium power may soon shake the world, creating millionaires and reshaping geo-politics. Soon electric vehicles (EVs) may be cheaper than gas guzzlers. Some are already reaching 265 miles on a single charge.With battery prices plummeting and charging stations set to multiply, one company stands out as the #1 stock to buy according to Zacks research. It's not the one you think.        See This Ticker Free >> The views and opinions expressed herein are the views and opinions of the author and do not necessarily reflect those of Nasdaq, Inc."
2017-10-09,ICE's Strong Derivative Trading Activity Is Likely To Boost Q3 Results,"Due to the rate hike in June, interest rate derivative volumes registered 36% growth in trading volumes. We expect the trading volume to grow with the Fed's indication of subsequent hikes in the year ahead. Meanwhile, we expect that metals - despite having shown a slight decline - will likely remain in demand as a safe investment asset.            See the full Trefis analysis for Intercontinental     Exchange    View Interactive Institutional Research (Powered by Trefis):    Global Large Cap  | U.S. Mid & Small Cap  | European Large & Mid Cap        More Trefis   Research The views and opinions expressed herein are the views and opinions of the author and do not necessarily reflect those of Nasdaq, Inc."
2018-04-25,Nasdaq beats estimates as volatility surge boosts trading volume,"By John McCrank and Nikhil SubbaApril 25 (Reuters) - Nasdaq Inc  is open to launching a cryptocurrency exchange in the future as the regulatory environment evolves, the head of the exchange operator said on Wednesday.The view that cryptocurrencies, such as bitcoin   will be a future way to support commerce is becoming more mainstream, Nasdaq's Chief Executive Officer, Adena Friedman, said in an interview following the announcement of better-than-expected quarterly earnings.""Over time, if it ultimately does morph into a regulated environment, it does give us an opportunity to participate as a marketplace, but I think that is a longer road and it doesn't have a certain path right now,"" she said.In the meantime, Nasdaq is exploring deals with several virtual currency exchanges to provide market infrastructure technology for trading and clearing, as well as surveillance, she said.Nasdaq on Wednesday announced a surveillance deal with Gemini Trust Company to monitor cryptocurrency trading on its exchange for potential market manipulation and fraud. EARNINGSNasdaq's net income in the first quarter rose to $177 million, or $1.05 per share, from $168 million, or 99 cents per share, a year earlier, helped by a volatility-driven spike in trading volumes. Stripping out special items, such as merger and acquisitions costs, the transatlantic exchange operator earned $1.24 per share, topping analysts' average estimates by four cents, according to Thomson Reuters I/B/E/S.Volatility spiked in February after a prolonged calm in 2017, roiling global equities, bonds, currencies and commodities markets, and remained elevated through the end of March.Revenue rose 14.6 percent to $666 million. Revenue from market services, the company's largest business, jumped more than 21 percent to $735 million.Sales from Nasdaq's non-trading related businesses also grew, with revenue from its market technology unit rising 7.7 percent to $70 million, and revenue from information services up 26 percent at $174 million.Corporate services, which includes market listings, rose 7.5 percent to $172 million, as Nasdaq saw 37 IPOs in the quarter, including those of cloud storage company Dropbox  and Chinese video streaming platform iQiyi."
2016-10-04,Add Up The Pieces: SPXT Could Be Worth $48,"10 ETFs With Most Upside To Analyst Targets » The views and opinions expressed herein are the views and opinions of the author and do not necessarily reflect those of Nasdaq, Inc."
