time,title,text
2016-10-26,Nasdaq (NDAQ) Q3 Earnings Meet Estimates; Revenues Miss,"Nasdaq, Inc . NDAQ provides trading, clearing, exchange technology, regulatory, securities listing, information, and public company services worldwide. The company has been focusing thoroughly on recognized technologies to help navigate the global capital markets towards potent, transparent and low-cost trading platforms. The company has positioned itself firmly for the long term growth via a number of strategic acquisitions in the non-transaction space over the past years. Nasdaq has been helping expand global exchanges with superior trading and clearing infrastructure, and build them as leading integrated multi-asset exchanges, thereby creating a niche for itself in the less-competitive zone. Additionally, the rising focus on the rapidly growing exchange-traded products (ETPs), to build a strong global index business, is evident from Nasdaq's strengthened distribution, technology and product generation capacities in this space. The inorganic story remains compelling with strategic buyouts. The company delivered positive surprise in two of last four quarters, making for an average surprise of 1.4%. Currently, Nasdaq has a Zacks Rank #3 (Hold), but that could definitely change following its earnings report that has just been released. The key takeaways from this immediate announcement are highlighted below:Earnings : Nasdaq meets estimates. Nasdaq reported record earnings per share of 91 cents per share in line with our Zacks Consensus Estimates.NASDAQ INC Price and EPS SurpriseNASDAQ INC Price and EPS Surprise | NASDAQ INC QuoteRevenue : Revenues missed our estimate. Our consensus called for revenues of $587 million, though the company reported record revenues of $585 million.Key Stats to Note•    Adjusted operating expenses were $317 million up 15% year over year. •    The quarter witnessed 74% of all U.S. IPOs were listed on Nasdaq. •    Achieved $23 million in annualized run-rate cost synergies as on Sep 30, 2016, out of $60 million intended. •    Net debt during the quarter increased 56% over 2015 end level to $3.7 billion as of Sep 30, 2016. •    Nasdaq bought back about $55 million worth shares in the quarter. •    Announces quarterly dividend of 32 cents per share on Oct 26, 2016. Check back later for our full write up on this NDAQ earnings report later!Confidential from Zacks Beyond this Tale of the Tape, would you like to see Zacks' best recommendations that are not available to the public? Our Executive VP, Steve Reitmeister, knows when key trades are about to be triggered and which of our experts has the hottest hand. Click to see them now>> The views and opinions expressed herein are the views and opinions of the author and do not necessarily reflect those of Nasdaq, Inc."
2018-07-10,"Nasdaq (NDAQ) Posts Mixed Q2 Volumes, Revenues Per Contract","Nasdaq, Inc.  NDAQ  has reported mixed volumes for second-quarter 2018. While U.S. equity options volume increased 8% year over year to 417 million contracts, European options and futures volumes registered 21.9 million contracts, down 1.4% year over year.          The Zacks Consensus Estimate for second-quarter bottom line is pegged at $1.18, reflecting a 15.7% year-over-year climb on 2.9% higher revenues. The company is set to report second-quarter 2018 earnings on Jul 25 before the market opens.     Our proven model does not conclusively show that the company is likely to beat estimates this to-be-reported quarter. This is because though the stock's Zacks Rank #2 (Buy) increases the predictive power of ESP, its combination with an Earnings ESP  of -2.27% leaves surprise prediction inconclusive as the company needs a positive ESP to be confident about an earnings surprise.You can see    the complete list of today's Zacks #1 Rank (Strong Buy)   stocks here   .     Concurrently, Nasdaq reported mixed June volumes. The U.S. equity options volume inched up nearly 1.5% year over year to 139 million contracts. However, the European options and futures volume was 6.6 million contracts, down 5.7% year over year.     Recently, securities exchanges such as CBOE Holdings Inc. CBOE  , CME Group Inc. CME  and MarketAxess Holdings Ltd. MKTX  also posted respective monthly volumes. While CBOE Global Markets' June ADV of 7.3 million contracts nudged up 1.6% year over year, CME Group's ADV of 18.4 million contracts rose 12% year over year. MarketAxess has reported a trading volume of $147.8 billion for June.     The Hottest Tech Mega-Trend of All      Last year, it generated $8 billion in global revenues. By 2020, it's predicted to blast through the roof to $47 billion. Famed investor Mark Cuban says it will produce ""the world's first trillionaires,"" but that should still leave plenty of money for regular investors who make the right trades early.         See Zacks' 3 Best Stocks to Play This Trend     >> The views and opinions expressed herein are the views and opinions of the author and do not necessarily reflect those of Nasdaq, Inc."
2017-05-10,Interest Rate And Metals Derivatives Boost CME's April Trading Volumes,"See    the full Trefis analysis for CME Group.  View Interactive Institutional Research (Powered by Trefis):    Global Large Cap   |  U.S. Mid & Small Cap  |  European Large & Mid Cap  |     More Trefis Research The views and opinions expressed herein are the views and opinions of the author and do not necessarily reflect those of Nasdaq, Inc."
2018-05-04,"US ECONOMICS: Payrolls Miss at 164,000 vs 191,000 Expected; Rate Drops to 3.9% vs 4% Consensus","The labor force dropped 236,000 after falling 158,000 in March, while household employment was up 3,000 after 37,000 drop previously. The labor force participation rate dipped to 62.8% from 62.9%. Private payrolls increased 168,000 (ADP was 204,000), with the goods producing sector adding 49,000, and with construction up 17,000. Manufacturing jobs rose 24,000. The private services sector added 119,000. Government jobs declined 4,000.The tameness of the overall report should cap Treasury yields and will likely keep the FOMC on a gradual path. The views and opinions expressed herein are the views and opinions of the author and do not necessarily reflect those of Nasdaq, Inc. Copyright (C) 2016 MTNewswires.com. All rights reserved. Unauthorized reproduction is strictly prohibited."
2017-07-26,"Nasdaq (NDAQ) Beats on Q2 Earnings, Tightens Expense View","Nasdaq, Inc  . NDAQ  reported second-quarter 2017 adjusted earnings per share of $1.02, beating the Zacks Consensus Estimate of 96 cents. Also, the bottom line improved 12.1% year over year.      Nasdaq, Inc. Price, Consensus and EPS Surprise                   Nasdaq, Inc. Price, Consensus and EPS   Surprise    |      Nasdaq, Inc. Quote   On a GAAP basis, the company's net income skyrocketed 93% year over year to 87 cents per share.     Performance in Detail      Nasdaq's revenues of record $602 million increased 7% year over year. Revenues beat the Zacks Consensus Estimate of $595.3 million, which  was primarily due to a $34 million positive impact from acquisitions and organic growth of $15 million.     Adjusted operating expenses were $315 million in the reported quarter, up 5% year over year. This was mainly due to higher operating expenses related to the acquisitions closed in 2016. As of Jun 30, 2017, Nasdaq achieved $60 million in annualized run-rate cost synergies. Besides, the company estimated $10-$20 million in additional synergies to be realized post completion of other platform consolidations.     Notably, the company tightened the upper end of its 2017 non-GAAP operating expense to the range of $1.26-$1.29 billion from $1.26-$1.30 billion guided earlier.     Segment wise, net revenue at Market Services  jumped 14.4% from the year-ago quarter to $222 million. The upside was driven by higher revenues from the ISE and higher European cash equities revenues.     Revenues at Corporate Services  increased 1.2% year over year to $164 million. This was mainly due to the inclusion of revenues from Boardvantage acquisitions.     Information Services revenues  rose 7.5% year over year to $144 million. Higher proprietary data products revenues and higher assets under management in exchange traded products linked to Nasdaq indexes, drove the upside.     Revenues at Market Technology  increased 4.3% year over year to $72 million due to organic revenue growth. Market Technology order intake totaled $64 million. The Nasdaq Stock Market witnessed 64 new listings during the first quarter, 36 of which were IPOs.     Financial Update      Nasdaq had cash and cash equivalents of $374 million as of Jun 30, 2017, down 10.5% from 2016-end level. As of Jun 30, 2017, debt decreased 15.1% over 2016-end level to $3.1 billion.     Dividend and Share Repurchase Update      The board of directors approved of a 38 cents per share quarterly dividend, which will be paid on Sep29, 2017 to shareholders of record on Sep 15, 2017.     The company had about $273 million remaining under its buyback authorization.     Our Take      Nasdaq's results reflect a decent performance. Growth looks encouraging as the company remains focused on expansion through acquisitions and organic initiatives that enable entry and open up cross-selling opportunities into new markets. The top line should also benefit from the company's consistent focus on its strategy to accelerate non-transaction revenue base, including technology, listing and information revenues. However, higher expenses and stiff competition remain key concerns.     Nasdaq carries a Zacks Rank #3 (Hold). You can see    the complete list of today's Zacks #1 Rank (Strong Buy)   stocks here   .     Among other securities exchanges, MarketAxess Holdings, Inc. MKTX  will report results   after the market closes  today. While CME Group Inc. CME  will report results on Aug 1, Intercontinental Exchange Inc. ICE  will report on Aug 3.   The Hottest Tech Mega-Trend of All Last year, it generated $8 billion in global revenues. By 2020, it's predicted to blast through the roof to $47 billion. Famed investor Mark Cuban says it will produce ""the world's first trillionaires,"" but that should still leave plenty of money for regular investors who make the right trades early.    See Zacks' 3 Best Stocks to Play This Trend   >> The views and opinions expressed herein are the views and opinions of the author and do not necessarily reflect those of Nasdaq, Inc."
2018-04-11,7 Reasons Why Nasdaq (NDAQ) Holds Promise for Investors,"Estimates for Nasdaq, Inc  . NDAQ  have been revised upward over the past 7 days, reflecting analysts' confidence in the stock, ahead of its first-quarter earnings. The stock has seen the Zacks Consensus Estimate for 2018 and 2019 earnings being raised 0.4% and 0.2% to $4.84 and $5.31, respectively.   Shares of this Zacks Rank #3 (Hold) securities exchange have rallied 12.4% year to date, outperforming the industry  's growth of 4.3%.        Let's focus on the factors making Nasdaq a stock to hold on to for greater returns.     Improving Top Line  : Last few years saw the top line rise at Nasdaq, witnessing a two-year CAGR of nearly 8%, owing to both organic and inorganic strategic expansions.     Compelling Inorganic Growth Story  : Strategic buyouts helped Nasdaq expedite growth profile, expand its technology offering, gain direct access to the Canadian equities market and fortify its Corporate Solutions business. Acquisitions continue to enhance the company's capabilities and have already been accretive to operational results.     Growth Initiatives  : Nasdaq deepened its focus on Market Technology and Information Services businesses, offering biggest growth opportunities per the company's developmental strategies. The company also sets sights on its core special marketplace platform businesses. However, it intends to lower capital resources for investment in business that fails to offer considerable growth for Nasdaq.     Nasdaq's organic growth has been aided by its strategy to accelerate its non-transaction revenue base, including market technology, listing and information revenues plus management's medium-term outlook, calling for mid-single digit growth over the next three to five years.     Intelligent Capital Management  : Nasdaq boasts a healthy balance sheet and cash position along with modest operating cash flow from its diverse business model. Banking on this strength, the board of directors has recently hiked its quarterly dividend by 16%. While the raise marks four-year CAGR of 35.6%, the company has a $500 million share buyback authorization. Its dividend yield betters the industry average, making the stock an attractive pick for yield-seeking investors.     Growth Projections  : The Zacks Consensus Estimate for current-year earnings per share is pegged at $8.41, representing a year-over-year increase of 19.2% on 4.9% higher revenues of $2.6 billion.     For 2019, the Zacks Consensus Estimate for earnings per share stands at $5.31 on $2.6 billion revenues, translating into a respective 9.7% and 3.1% year-over-year increase.     Nasdaq has expected long-term earnings per share growth of 9.7%.     Underpriced  : Looking at the company's price-to-book ratio - the best multiple for valuing securities exchanges because of large variations in their earnings results from one quarter to the next - shares are underpriced at the current level. The company has a trailing 12-month P/B ratio of 2.43, falling below the industry average of 2.76.     Positive Earnings Surprise History  : The company flaunts an encouraging earnings surprise history, having outpaced the Zacks Consensus Estimate in each of the trailing five quarters with an average beat of 3.99%. This trend of consecutive estimate beats indicates the company's operational excellence.     In fact, our proven model states that the company is poised for an earnings beat in the to-be-reported quarter. This is because the stock has the right combination of the following two key ingredients for a positive earnings surprise, a favorable Zacks Rank #3 (Hold), which increases the predictive power of ESP and an  Earnings ESP  of +1.06% to be confident about an estimate beat.     Stocks to Consider      Some better-ranked stocks from the finance sector are CME Group Inc. CME  , CNA Financial Corporation. CNA  and AllianceBernstein Holding L.P. AB  , each sporting a Zacks Rank #1 (Strong Buy). You can see    the complete list of today's Zacks #1 Rank stocks   here   .     CME Group operates in contract markets for the trading of futures and options on futures contracts worldwide. It came up with an average four-quarter beat of 2.15%.     CNA Financial provides commercial property and casualty insurance products, primarily in the United States. It pulled off an average four-quarter positive earnings surprise of 46.88%.     Investment manager AllianceBernstein provides research services to its clients. It delivered an average four-quarter beat of 8.54%.     5 Medical Stocks to Buy Now      Zacks names 5 companies poised to ride a medical breakthrough that is targeting cures for leukemia, AIDS, muscular dystrophy, hemophilia, and other conditions.     New products in this field are already generating substantial revenue and even more wondrous treatments are in the pipeline. Early investors could realize exceptional profits.        Click here to see the 5 stocks >> The views and opinions expressed herein are the views and opinions of the author and do not necessarily reflect those of Nasdaq, Inc."
2017-02-07,Intercontinental Exchange (ICE) Tops Q4 Earnings; Costs Up,"Intercontinental Exchange, Inc.  ICE  reported fourth-quarter 2016 adjusted earnings per share of 71 cents, beating the Zacks Consensus Estimate of 69 cents. Also, earnings improved 9.2% year over year.      Intercontinental Exchange Inc. Price, Consensus and EPS   Surprise                   Intercontinental Exchange Inc. Price, Consensus   and EPS Surprise    |      Intercontinental Exchange Inc. Quote   Intercontinental Exchange presently carries a Zacks Rank #3 (Hold). You can see    the complete list of today's Zacks #1 Rank (Strong Buy)   stocks here   .      Among others, CBOE Holdings, Inc. CBOE  reported fourth-quarter 2016 adjusted earnings of 63 cents per share, beating the Zacks Consensus Estimate of 60 cents. Also, the bottom line increased 7% year over year.     CME Group Inc. CME  reported fourth-quarter 2016 adjusted earnings per share of $1.14, beating the Zacks Consensus Estimate of $1.10. The bottom line also improved 17.5% from the year-ago quarter.     Nasdaq, Inc. NDAQ  reported fourth-quarter 2016 adjusted earnings per share of 95 cents per share, beating the Zacks Consensus Estimate by a penny. Further, the bottom line improved 7% year over year.     Just Released - Driverless Cars: Your Roadmap to Mega-Profits Today      In this latest Special Report, Zacks' Aggressive Growth Strategist Brian Bolan explores a full-blown technological breakthrough in the making - autonomous cars. He also spotlights 8 stocks with tremendous gain potential to feed off this phenomenon.    Click to see the stocks right now >> The views and opinions expressed herein are the views and opinions of the author and do not necessarily reflect those of Nasdaq, Inc."
2018-07-06,NY jury convicts two men for trading on hacked press releases,"By Jonathan StempelNEW YORK, July 6 (Reuters) - A federal jury in Brooklyn, New York on Friday convicted two men for their roles in an international scheme to make millions of dollars by illegally trading on corporate press releases that were stolen by computer hackers before they became public.Vitaly Korchevsky, a Pennsylvania pastor and former Morgan Stanley  vice president, and co-defendant Vladislav Khalupsky were each found guilty on two securities fraud and three conspiracy counts, a spokesman for U.S. Attorney Richard Donoghue in Brooklyn said.Authorities said more than 150,000 press releases were stolen from Business Wire, Marketwired and PR Newswire from February 2010 to August 2015, and used to generated in excess of $100 million of illegal trading profit.Traders allegedly gave hackers ""shopping lists"" or ""wish lists"" of releases they wanted to see in advance, and traded in such companies as Advanced Micro Devices Inc, Caterpillar Inc, Home Depot Inc, Panera Bread Co, Qualcomm Inc  and Weight Watchers International Inc.Korchevsky, 53, has lived in Glen Mills, Pennsylvania, while Khalupsky, 48, has lived in Brooklyn and Odessa, Ukraine, prosecutors said. Their trial began on June 12. ""It is a sad day for Mr. Korchevsky,"" his lawyer Steven Brill said in an email. ""But we will fight on and begin preparing for sentencing and a full appeal.""""We are clearly disappointed in the verdict, but will continue to fight for Mr. Khalupsky through sentencing and appeal,"" his lawyer Mildred Whalen said in an email.Business Wire is owned by Warren Buffett'sBerkshire Hathaway Inc, PR Newswire is owned by Cision Ltd, and Marketwired is owned by West Corp.None was accused of wrongdoing.The case is U.S. v. Korchevsky et al, U.S. District Court, Eastern District of New York, No. 15-cr-00381."
2017-11-02,"Intercontinental Exchange (ICE) Q3 Earnings Beat, Up Y/Y","Intercontinental Exchange, Inc.  ICE  reported third-quarter 2017 adjusted earnings per share of 73 cents, which beat the Zacks Consensus Estimate by 2.8%. The bottom line improved 14% on a year-over-year basis.      Intercontinental Exchange Inc. Price, Consensus and EPS   Surprise                    Intercontinental Exchange Inc. Price, Consensus   and EPS Surprise    |      Intercontinental Exchange Inc. Quote   On a GAAP basis, net income was 62 cents per share, up 9% year over year.     Performance in Detail      Intercontinental Exchange's revenues of $1.1 billion increased 6% year over year on higher data service revenues. Results however came almost in line with the Zacks Consensus Estimate.     Total operating expenses decreased 9.4% year over year to $547 million, primarily driven by lower compensation and benefits, professional service, acquisition-related transaction as well as integration costs.     Operating income improved 25.7% year over year to $596 million. Operating margin thus expanded 800 basis points to 52%.     Financial Update      At the end of the reported quarter, Intercontinental Exchange had cash and cash equivalents of $419 million, up 2.9% from Dec 31, 2016. Long-term debt of $4.9 billion increased 25.7% from the 2016-end level.     Total equity was $15.9 billion as of Sep 30, 2017 compared with $15.6 billion as of Dec 31, 2016.     Capital Deployment      Intercontinental Exchange paid back more than $1 billion to shareholders year to date. The company remains on track to pay back $1.4 billion in 2017.     The board of directors approved a $1.2 billion share buyback program and quarterly divdends of 20 cents.     Guidance      Adjusted operating expenses are estimated between $475 million and $485 million while GAAP operating expenses are estimated between $540 million and $550 million for the fourth quarter.     Interest expense is projected to be $50 million in the fourth quarter.     Intercontinental Exchange's share count for the fourth quarter is likely to be in the range of 585-595 million.     Our Take      Results of Intercontinental Exchange reflect a solid performance. The company remains well-poised for growth, given its strength in energy franchise, increasing the recurring market data revenues and strategic initiatives. The company remains focused to enhance its shareholders' value.     Intercontinental Exchange stated that it is on track to exceed its original 2017 synergy target while investing in growth initiatives in 2018.     Intercontinental Exchange presently carries a Zacks Rank #3 (Hold). You can see    the complete list of today's Zacks #1 Rank (Strong Buy)   stocks here   .     Among other securities exchanges, the bottom line at CME Group Inc. CME  and Nasdaq, Inc. NDAQ  beat the respective Zacks Consensus Estimate while the same at MarketAxess, Inc. MKTX  missed the estimates last quarter.     Zacks' Best Private Investment Ideas      While we are happy to share many articles like this on the website, our best recommendations and most in-depth research are not available to the public.     Starting today, for the next month, you can follow all Zacks' private buys and sells in real time. Our experts cover all kinds of trades… from value to momentum . . . from stocks under $10 to ETF and option moves . . . from stocks that corporate insiders are buying up to companies that are about to report positive earnings surprises. You can even look inside exclusive portfolios that are normally closed to new investors.        Click here for Zacks' private trades >> The views and opinions expressed herein are the views and opinions of the author and do not necessarily reflect those of Nasdaq, Inc."
2017-01-10,"Noteworthy Tuesday Option Activity: AAPL, CAT, NDAQ","Today's Most Active Call & Put Options of the   S&P 500 » The views and opinions expressed herein are the views and opinions of the author and do not necessarily reflect those of Nasdaq, Inc."
2017-10-10,"Nasdaq (NDAQ) Posts Mixed Q3 Volumes, Revenue per Contract","Nasdaq, Inc  . NDAQ  has reported mixed volumes for third-quarter 2017. While the U.S. equity options volume improved 4.9% year over year to 364 million contracts, revenue per contract was 14 cents and declined 17.6% on a year-over-year basis.  Market share jumped to 41.0% from 39.2% in the year-ago quarter       Our proven model does not conclusively show if the company is poised to beat on earnings this quarter. Nasdaq currently carries a Zacks Rank #4 (Sell), which lowers the predictive power of ESP. However, when the same is combined with a Earnings ESP  of +0.49%, it leaves the surprise prediction inconclusive.     You can see    the complete list of today's Zacks #1 Rank (Strong Buy)   stocks here   .     Concurrently, Nasdaq reported lower September 2017 volumes, reflecting a fall in trading activities. The U.S. equity options volume decreased 5.7% year over year to 116 million contracts. However, the European options and futures volume was 8 million contracts, flat year over year.     Recently, securities exchanges namely, CBOE Holdings Inc. CBOE  , CME Group Inc. CME  and MarketAxess Holdings Ltd. MKTX  also posted their September volumes.     CBOE Holdings' ADV reduced 5.4% to 7.0 million contracts per day, while CME Group witnessed a 13% rise in ADV to 17 million contracts. MarketAxess' monthly trading volume for September was $116.8 billion. Today's Stocks from Zacks' Hottest Strategies  It's hard to believe, even for us at Zacks. But while the market gained +18.8% from 2016 - Q1 2017, our top stock-picking screens have returned +157.0%, +128.0%, +97.8%, +94.7%, and +90.2% respectively.And this outperformance has not just been a recent phenomenon. Over the years it has been remarkably consistent. From 2000 - Q1 2017, the composite yearly average gain for these strategies has beaten the market more than 11X over. Maybe even more remarkable is the fact that we're willing to share their latest stocks with you without cost or obligation.    See Them Free>> The views and opinions expressed herein are the views and opinions of the author and do not necessarily reflect those of Nasdaq, Inc."
